{
  "type": "Annotation",
  "id": "https://annotations.allmaps.org/maps/CFqQGwiHhs5Bf4Bu",
  "@context": [
    "http://www.w3.org/ns/anno.jsonld",
    "http://geojson.org/geojson-ld/geojson-context.jsonld",
    "http://iiif.io/api/presentation/3/context.json"
  ],
  "motivation": "georeferencing",
  "target": {
    "type": "Image",
    "source": "https://cdm21033.contentdm.oclc.org/iiif/2/krt:2891/full/full/0/default.jpg",
    "service": [
      {
        "@id": "https://cdm21033.contentdm.oclc.org/iiif/2/krt:2891",
        "type": "ImageService2"
      }
    ],
    "selector": {
      "type": "SvgSelector",
      "value": "<svg width=\"5965\" height=\"2514\"><polygon points=\"5917,2354 5908,79 71,81 62,2316 5917,2354\" /></svg>"
    }
  },
  "body": {
    "type": "FeatureCollection",
    "purpose": "gcp-georeferencing",
    "transformation": {
      "type": "polynomial",
      "options": {
        "order": 1
      }
    },
    "features": [
      {
        "type": "Feature",
        "id": "3gaP7eqrmBQsDVZB",
        "properties": {
          "pixelCoords": [5589, 449]
        },
        "geometry": {
          "type": "Point",
          "coordinates": [4.5004097, 51.9163697]
        }
      },
      {
        "type": "Feature",
        "id": "91Wc5Hkru2CApuqT",
        "properties": {
          "pixelCoords": [2027, 402]
        },
        "geometry": {
          "type": "Point",
          "coordinates": [4.4066919, 51.9088182]
        }
      },
      {
        "type": "Feature",
        "id": "GymShheYQL6bpit9",
        "properties": {
          "pixelCoords": [4089, 1688]
        },
        "geometry": {
          "type": "Point",
          "coordinates": [4.4660261, 51.8927421]
        }
      },
      {
        "type": "Feature",
        "id": "gCvdaSWgKgx3Ht6Y",
        "properties": {
          "pixelCoords": [4323, 1333]
        },
        "geometry": {
          "type": "Point",
          "coordinates": [4.4705962, 51.8992239]
        }
      }
    ]
  }
}
